[
  {
    "trophy_id": "TROPHY_STATUETTE_001",
    "winner_record_id": "WIN_NOM_001_RECORD_OF__0000",
    "recipient_creator_id": "CRT_NEL_BLU_DIPINTO_DI_BLU_VOLARE_0000",
    "statuette_serial_number": "GRAM-2023-SN-10000",
    "engraved_billing_text": "Presented to CRT_NEL_BLU_DIPINTO_DI_BLU_VOLARE_0000 For Excellence in Musical Recording",
    "manufacturing_foundry_name": "Billings Artworks (Ridgway, Colorado)",
    "grammium_alloy_specification": "Grammium-Alloy-Formula-IV",
    "gold_plating_thickness_microns": 5.25,
    "dispatch_shipment_date": "1959-04-15",
    "custody_receipt_hash": "1d12876cb6155ef2afa3ea9f0b8969a69a0c24221e6af9947e9bbc0198b52d0c"
  },
  {
    "trophy_id": "TROPHY_STATUETTE_002",
    "winner_record_id": "WIN_NOM_001_ALBUM_OF_T_0001",
    "recipient_creator_id": "CRT_HENRY_MANCINI_0001",
    "statuette_serial_number": "GRAM-2023-SN-10001",
    "engraved_billing_text": "Presented to CRT_HENRY_MANCINI_0001 For Excellence in Musical Recording",
    "manufacturing_foundry_name": "Billings Artworks (Ridgway, Colorado)",
    "grammium_alloy_specification": "Grammium-Alloy-Formula-IV",
    "gold_plating_thickness_microns": 5.25,
    "dispatch_shipment_date": "1959-04-15",
    "custody_receipt_hash": "a6687a329289e100dbf655019092c11f323bf5644486d3a9d8adfbd725aff9d1"
  },
  {
    "trophy_id": "TROPHY_STATUETTE_003",
    "winner_record_id": "WIN_NOM_001_SONG_OF_TH_0002",
    "recipient_creator_id": "CRT_NEL_BLU_DIPINTO_DI_BLU_VOLARE_0000",
    "statuette_serial_number": "GRAM-2023-SN-10002",
    "engraved_billing_text": "Presented to CRT_NEL_BLU_DIPINTO_DI_BLU_VOLARE_0000 For Excellence in Musical Recording",
    "manufacturing_foundry_name": "Billings Artworks (Ridgway, Colorado)",
    "grammium_alloy_specification": "Grammium-Alloy-Formula-IV",
    "gold_plating_thickness_microns": 5.25,
    "dispatch_shipment_date": "1959-04-15",
    "custody_receipt_hash": "21ea131a4946b443bfd01fa6e45b8bfb1f0a29cdeeaa28a57e43ac1ce6aa33fa"
  },
  {
    "trophy_id": "TROPHY_STATUETTE_004",
    "winner_record_id": "WIN_NOM_001_BEST_VOCAL_0003",
    "recipient_creator_id": "CRT_ELLA_FITZGERALD_0002",
    "statuette_serial_number": "GRAM-2023-SN-10003",
    "engraved_billing_text": "Presented to CRT_ELLA_FITZGERALD_0002 For Excellence in Musical Recording",
    "manufacturing_foundry_name": "Billings Artworks (Ridgway, Colorado)",
    "grammium_alloy_specification": "Grammium-Alloy-Formula-IV",
    "gold_plating_thickness_microns": 5.25,
    "dispatch_shipment_date": "1959-04-15",
    "custody_receipt_hash": "f1a0af2cd818a5abb303f4b9bcfa52bbcebe18d6c3cb454d67dbb15a699c0d57"
  },
  {
    "trophy_id": "TROPHY_STATUETTE_005",
    "winner_record_id": "WIN_NOM_001_BEST_VOCAL_0004",
    "recipient_creator_id": "CRT_CATCH_A_FALLING_STAR_0003",
    "statuette_serial_number": "GRAM-2023-SN-10004",
    "engraved_billing_text": "Presented to CRT_CATCH_A_FALLING_STAR_0003 For Excellence in Musical Recording",
    "manufacturing_foundry_name": "Billings Artworks (Ridgway, Colorado)",
    "grammium_alloy_specification": "Grammium-Alloy-Formula-IV",
    "gold_plating_thickness_microns": 5.25,
    "dispatch_shipment_date": "1959-04-15",
    "custody_receipt_hash": "24ba1d32f25e4d3e149ad75c24410cf574ffd200a0cdebf860c0470c9aa4aef0"
  },
  {
    "trophy_id": "TROPHY_STATUETTE_006",
    "winner_record_id": "WIN_NOM_001_BEST_PERFO_0005",
    "recipient_creator_id": "CRT_BILLY_MAY_S_BIG_FAT_BRASS_0004",
    "statuette_serial_number": "GRAM-2023-SN-10005",
    "engraved_billing_text": "Presented to CRT_BILLY_MAY_S_BIG_FAT_BRASS_0004 For Excellence in Musical Recording",
    "manufacturing_foundry_name": "Billings Artworks (Ridgway, Colorado)",
    "grammium_alloy_specification": "Grammium-Alloy-Formula-IV",
    "gold_plating_thickness_microns": 5.25,
    "dispatch_shipment_date": "1959-04-15",
    "custody_receipt_hash": "b8b2811bc6484829b1ba5c113563f4dc5f9729db627152fe736dd247bd9b79b3"
  },
  {
    "trophy_id": "TROPHY_STATUETTE_007",
    "winner_record_id": "WIN_NOM_001_BEST_PERFO_0006",
    "recipient_creator_id": "CRT_BASIE_0005",
    "statuette_serial_number": "GRAM-2023-SN-10006",
    "engraved_billing_text": "Presented to CRT_BASIE_0005 For Excellence in Musical Recording",
    "manufacturing_foundry_name": "Billings Artworks (Ridgway, Colorado)",
    "grammium_alloy_specification": "Grammium-Alloy-Formula-IV",
    "gold_plating_thickness_microns": 5.25,
    "dispatch_shipment_date": "1959-04-15",
    "custody_receipt_hash": "e5d500ff714bd3876800aa9666887ad500b11e75fb6558ba2c3e1fa07966e5c3"
  },
  {
    "trophy_id": "TROPHY_STATUETTE_008",
    "winner_record_id": "WIN_NOM_001_BEST_PERFO_0007",
    "recipient_creator_id": "CRT_THAT_OLD_BLACK_MAGIC_0006",
    "statuette_serial_number": "GRAM-2023-SN-10007",
    "engraved_billing_text": "Presented to CRT_THAT_OLD_BLACK_MAGIC_0006 For Excellence in Musical Recording",
    "manufacturing_foundry_name": "Billings Artworks (Ridgway, Colorado)",
    "grammium_alloy_specification": "Grammium-Alloy-Formula-IV",
    "gold_plating_thickness_microns": 5.25,
    "dispatch_shipment_date": "1959-04-15",
    "custody_receipt_hash": "160b76a7b8eb0102e3134dbd9bc49f3eabad052f0087e1d4dfbb76423c8cad4e"
  },
  {
    "trophy_id": "TROPHY_STATUETTE_009",
    "winner_record_id": "WIN_NOM_001_BEST_JAZZ__0008",
    "recipient_creator_id": "CRT_ELLA_FITZGERALD_0002",
    "statuette_serial_number": "GRAM-2023-SN-10008",
    "engraved_billing_text": "Presented to CRT_ELLA_FITZGERALD_0002 For Excellence in Musical Recording",
    "manufacturing_foundry_name": "Billings Artworks (Ridgway, Colorado)",
    "grammium_alloy_specification": "Grammium-Alloy-Formula-IV",
    "gold_plating_thickness_microns": 5.25,
    "dispatch_shipment_date": "1959-04-15",
    "custody_receipt_hash": "d9feb47d9d5f56af2946d3246e9a02d8deb92118ac91a65dfcd11f1b4367fef3"
  },
  {
    "trophy_id": "TROPHY_STATUETTE_010",
    "winner_record_id": "WIN_NOM_001_BEST_JAZZ__0009",
    "recipient_creator_id": "CRT_BASIE_0005",
    "statuette_serial_number": "GRAM-2023-SN-10009",
    "engraved_billing_text": "Presented to CRT_BASIE_0005 For Excellence in Musical Recording",
    "manufacturing_foundry_name": "Billings Artworks (Ridgway, Colorado)",
    "grammium_alloy_specification": "Grammium-Alloy-Formula-IV",
    "gold_plating_thickness_microns": 5.25,
    "dispatch_shipment_date": "1959-04-15",
    "custody_receipt_hash": "4ed10b82e2579ba69013b3f91b6071a0615632551621815270b0b9b529c4e0f5"
  },
  {
    "trophy_id": "TROPHY_STATUETTE_011",
    "winner_record_id": "WIN_NOM_001_BEST_COMED_0010",
    "recipient_creator_id": "CRT_THE_CHIPMUNK_SONG_0007",
    "statuette_serial_number": "GRAM-2023-SN-10010",
    "engraved_billing_text": "Presented to CRT_THE_CHIPMUNK_SONG_0007 For Excellence in Musical Recording",
    "manufacturing_foundry_name": "Billings Artworks (Ridgway, Colorado)",
    "grammium_alloy_specification": "Grammium-Alloy-Formula-IV",
    "gold_plating_thickness_microns": 5.25,
    "dispatch_shipment_date": "1959-04-15",
    "custody_receipt_hash": "73159aab62fd784ab2c370f229c1517d510f93af882dcf54d164255de0fa8a11"
  },
  {
    "trophy_id": "TROPHY_STATUETTE_012",
    "winner_record_id": "WIN_NOM_001_BEST_COUNT_0011",
    "recipient_creator_id": "CRT_TOM_DOOLEY_0008",
    "statuette_serial_number": "GRAM-2023-SN-10011",
    "engraved_billing_text": "Presented to CRT_TOM_DOOLEY_0008 For Excellence in Musical Recording",
    "manufacturing_foundry_name": "Billings Artworks (Ridgway, Colorado)",
    "grammium_alloy_specification": "Grammium-Alloy-Formula-IV",
    "gold_plating_thickness_microns": 5.25,
    "dispatch_shipment_date": "1959-04-15",
    "custody_receipt_hash": "1be3f144a57bb6235b53b1d3f29b3765afb19c72551e59effde02d9a040981bf"
  },
  {
    "trophy_id": "TROPHY_STATUETTE_013",
    "winner_record_id": "WIN_NOM_001_BEST_RHYTH_0012",
    "recipient_creator_id": "CRT_TEQUILA_0009",
    "statuette_serial_number": "GRAM-2023-SN-10012",
    "engraved_billing_text": "Presented to CRT_TEQUILA_0009 For Excellence in Musical Recording",
    "manufacturing_foundry_name": "Billings Artworks (Ridgway, Colorado)",
    "grammium_alloy_specification": "Grammium-Alloy-Formula-IV",
    "gold_plating_thickness_microns": 5.25,
    "dispatch_shipment_date": "1959-04-15",
    "custody_receipt_hash": "ec9060074e76dca031ec90a411bf807ecfbe4ffb4c8458379c23db53323125f9"
  },
  {
    "trophy_id": "TROPHY_STATUETTE_014",
    "winner_record_id": "WIN_NOM_001_BEST_ARRAN_0013",
    "recipient_creator_id": "CRT_HENRY_MANCINI_0001",
    "statuette_serial_number": "GRAM-2023-SN-10013",
    "engraved_billing_text": "Presented to CRT_HENRY_MANCINI_0001 For Excellence in Musical Recording",
    "manufacturing_foundry_name": "Billings Artworks (Ridgway, Colorado)",
    "grammium_alloy_specification": "Grammium-Alloy-Formula-IV",
    "gold_plating_thickness_microns": 5.25,
    "dispatch_shipment_date": "1959-04-15",
    "custody_receipt_hash": "018b6c14a6054113f470167f32496fab878e62f22ace97e890026d13f7d50247"
  },
  {
    "trophy_id": "TROPHY_STATUETTE_015",
    "winner_record_id": "WIN_NOM_001_BEST_ENGIN_0014",
    "recipient_creator_id": "CRT_DUETS_WITH_A_SPANISH_GUITAR_0010",
    "statuette_serial_number": "GRAM-2023-SN-10014",
    "engraved_billing_text": "Presented to CRT_DUETS_WITH_A_SPANISH_GUITAR_0010 For Excellence in Musical Recording",
    "manufacturing_foundry_name": "Billings Artworks (Ridgway, Colorado)",
    "grammium_alloy_specification": "Grammium-Alloy-Formula-IV",
    "gold_plating_thickness_microns": 5.25,
    "dispatch_shipment_date": "1959-04-15",
    "custody_receipt_hash": "004b24040bf70fb9191f149648b9c4851d554324c3fe4f55d6459950ba5fb7e3"
  },
  {
    "trophy_id": "TROPHY_STATUETTE_016",
    "winner_record_id": "WIN_NOM_001_BEST_ENGIN_0015",
    "recipient_creator_id": "CRT_THE_CHIPMUNK_SONG_0007",
    "statuette_serial_number": "GRAM-2023-SN-10015",